{"Content-Type": "message/rfc822", "Content-Type-Override": "message/rfc822", "MboxParser-from": "r  Fri Nov  5 10:16:54 2004", "MboxParser-http": "//news.bbc.co.uk/1/hi/world/americas/502503.stm", "MboxParser-mime-version": "1.0", "MboxParser-reply-to": "amirebrahimi@virgilio.it", "MboxParser-status": ["RO", "RO "], "MboxParser-x-authentication-warning": "servicos.te.pt: apache set sender to amir_04@educacao.te.pt using -f ", "MboxParser-x-ipaddress": "81.134.37.121", "MboxParser-x-mailer": "NeoMail 1.22", "MboxParser-x-sieve": "CMU Sieve 2.2 ", "Message-Recipient-Address": "amir_04@educacao.te.pt ", "Message-To": "amir_04@educacao.te.pt ", "Message:From-Email": "amir_04@educacao.te.pt", "Message:From-Name": "Amir Ebrahimi", "Message:Raw-Header:Status": "RO", "X-TIKA:Parsed-By": ["org.apache.tika.parser.DefaultParser", "org.apache.tika.parser.mail.RFC822Parser"], "X-TIKA:content": "\n\n\n\n\n\n\n\n\n\n\n\n\n\n\n\n\n\n\n\n\n\n\n\n\n\n\n\n\n\nX-Sieve: CMU Sieve 2.2\nDate: Fri, 5 Nov 2004 14:24:42 GMT\nMessage-Id: <200411051424.iA5EOfg16776@servicos.te.pt>\nX-Authentication-Warning: servicos.te.pt: apache set sender to amir_04@educacao.te.pt using -f\nFrom: \"Amir Ebrahimi \" <amir_04@educacao.te.pt>\nTo: amir_04@educacao.te.pt\nReply-To: amirebrahimi@virgilio.it\nSubject: IMPORTANT NOTICE!!!\nX-Mailer: NeoMail 1.22\nX-IPAddress: 81.134.37.121\nMIME-Version: 1.0\nContent-Type: text/plain; charset=iso-8859-1\nStatus: RO\n\nFIRST MERIT BANK \nSWINDON,UNITED KINGDOM\n\n\nDear Partner \nPRIVATE AND URGENT. \n \nI am Mr Amir Ebrahimi, and I am  contacting you on\nbusiness transfer of a huge sum of money from a\ndeceased account. Though I know that a transaction of\nthis magnitude will make anyone apprehensive and\nworried, but I am assuring you that all will be well\nat the end of the day. I decided to contact you due to\nthe urgency of this transaction. \n \nPROPOSITION; \nI am the account officer to Mr Abdullah Saleh (deceased)\none of our foreign customers. While he banked with us,\nI oversaw his accounts and other official/financial\nobligations as my office demanded being his accounts\nofficer.Unfortunately, he died along with his entire\nfamily in the plane crash of 31 October, 1999 on board\nthe Egyptian Airline 990 alonside other passengers.\nPlease consult the British Broadcasting Corporation website\nbelow for verification. \n \nhttp://news.bbc.co.uk/1/hi/world/americas/502503.stm\n \nWhile he was alive, none of his family members was\never known to me other than his immediate nuclear\nfamily.Since his death, none of his next-of-kin or\nrelations has come forward to lay claims to this money\nas the heir. I cannot release the fund from his\naccount unless someone applies for claim as the\nnext-of-kin to the deceased as indicated in our\nbanking guidelines. \nHaving made a very  exhaustive search for\nany family member that would lay claim to this fund, I\ndecided to take my chance with you.I now seek your\npermission to have you stand as next of kin to the\ndeceased as I have all documentations including his\ncertified Death Certificate that will facilitate your\nstand as next of kin to him as he had a closing\nbalanced of 5,500,000.00 Five million five hundred \nthousand British pounds sterling) here in\nour bank in united kingdom. I also have secured from the\nprobate an order of mandamus to locate any member of\ndeceased family to become beneficiary of this fund. \nPlease acknowledge receipt of this message in\nacceptance of our mutual business endeavour by\nfurnishing me with the following; \n1. Full name and address \n2. Direct Telephone and fax numbers \nThese requirements will enable me make some internal\nre-adjustments and file your name in form A2ag and\nother vital forms as next of kin which before now was\nleft blank by the deceased upon opening of the account\nsix years ago. Upon your reply, I will advice the way\nforward. I must assure you that if you are serious and\nfollow my lead religiously, then this funds will be\nreleased to you within a seven-working-day period.\nIf this proposal is acceptable by you, do not take\nundue advantage of the trust I have bestowed in you, I\nawait your urgent mail. \nPlease reply \n \nRegards, \nMr.Amir Ebrahimi\n \n\n \n \n\n\n\n\n", "X-TIKA:content_handler": "ToTextContentHandler", "X-TIKA:embedded_depth": "1", "X-TIKA:embedded_resource_path": "/embedded-1225", "X-TIKA:parse_time_millis": "1", "dc:creator": "\"Amir Ebrahimi \" <amir_04@educacao.te.pt> ", "dc:format": "text/plain; charset=iso-8859-1", "dc:identifier": "<200411051424.iA5EOfg16776@servicos.te.pt> ", "dc:subject": "IMPORTANT NOTICE!!!", "dcterms:created": "2004-11-05T14:24:42Z"}